collision_id,domain,current_gate_status,export_status,unresolved_hold_status,pharmacist_signoff_status,facility_evidence_status,specialist_review_status,pmda_product_resolution_status,rag_regression_run_status,required_owner_roles,blocking_items,allowed_next_action,prohibited_next_action,safe_to_promote,notes,updated_at
GAP-V3-COLLISION-NEURO-ONC-001,neuro_oncology,HOLD_REFERENCE_ONLY;unresolved_intentional_hold,DO_NOT_EXPORT,unresolved_intentional_hold,NOT_SIGNED_OFF,NO_FACILITY_EVIDENCE,NOT_COMPLETED,UNRESOLVED,NOT_RUN,pharmacist;operator,TMZ/PCV/bevacizumab/carmustine_wafer PMDA; facility oncology formulary; no disease-note merge,keep_hold;collect_evidence;run_regression;review_prepare,promote;export;merge_to_disease_note;apply_preview_promotion,false,Generated from collision_resolution_ledger; not clinical sign-off. PMDA product resolution per drug; pharmacist review high-risk profiles,2026-06-05
GAP-V3-COLLISION-PITUITARY-001,pituitary_endocrine,HOLD_REFERENCE_ONLY;unresolved_intentional_hold,DO_NOT_EXPORT,unresolved_intentional_hold,NOT_SIGNED_OFF,NO_FACILITY_EVIDENCE,NOT_COMPLETED,UNRESOLVED,NOT_RUN,pharmacist;endocrinology,post-op DI/stress steroid/SIADH-CSW context; cabergoline/octreotide PMDA; endocrine pathway,keep_hold;collect_evidence;run_regression;review_prepare,promote;export;merge_to_disease_note;apply_preview_promotion,false,Generated from collision_resolution_ledger; not clinical sign-off. Endocrine+neurosurgery joint review; map formulary pathways,2026-06-05
GAP-V3-COLLISION-PERIOP-VIS-CONTRAST-001,perioperative_visualization_contrast,HOLD_REFERENCE_ONLY;unresolved_intentional_hold,DO_NOT_EXPORT,unresolved_intentional_hold,NOT_SIGNED_OFF,NO_FACILITY_EVIDENCE,NOT_COMPLETED,PARTIAL_OR_NOT_REQUIRED,NOT_RUN,pharmacist;radiology;anesthesia,5-ALA/ICG/fluorescein procedural only; contrast SOP; metformin/renal/thyroid facility rules,keep_hold;collect_evidence;run_regression;review_prepare,promote;export;merge_to_disease_note;apply_preview_promotion,false,Generated from collision_resolution_ledger; not clinical sign-off. Facility radiology+anesthesia contrast SOP review,2026-06-05
GAP-V3-COLLISION-CSF-IIH-001,csf_iih,HOLD_REFERENCE_ONLY;unresolved_intentional_hold,DO_NOT_EXPORT,unresolved_intentional_hold,NOT_SIGNED_OFF,NO_FACILITY_EVIDENCE,NOT_COMPLETED,UNRESOLVED,NOT_RUN,pharmacist;neurosurgery,IIH vs ICP vs tumor-edema dexamethasone separation; no fixed dosing,keep_hold;collect_evidence;run_regression;review_prepare,promote;export;merge_to_disease_note;apply_preview_promotion,false,Generated from collision_resolution_ledger; not clinical sign-off. Separate IIH vs tumor-edema pathways in facility protocol,2026-06-05
GAP-V3-COLLISION-VASOSPASM-ENDOVASCULAR-001,vasospasm_endovascular_procedural,HOLD_REFERENCE_ONLY;unresolved_intentional_hold,DO_NOT_EXPORT,unresolved_intentional_hold,NOT_SIGNED_OFF,NO_FACILITY_EVIDENCE,NOT_COMPLETED,UNRESOLVED,NOT_RUN,pharmacist;neuro_icu,bosentan!=clazosentan; systemic SAH vs IA/IT; nicardipine context separation,keep_hold;collect_evidence;run_regression;review_prepare,promote;export;merge_to_disease_note;apply_preview_promotion,false,Generated from collision_resolution_ledger; not clinical sign-off. Separate systemic SAH vs IA/IT pathways; enforce bosentan negative rule,2026-06-05
GAP-V3-COLLISION-SPASTICITY-FUNCTIONAL-001,spasticity_functional_neurosurgery,HOLD_REFERENCE_ONLY;unresolved_intentional_hold,DO_NOT_EXPORT,unresolved_intentional_hold,NOT_SIGNED_OFF,NO_FACILITY_EVIDENCE,NOT_COMPLETED,PARTIAL_OR_NOT_REQUIRED,NOT_RUN,pharmacist;rehab;functional_neurosurgery,ITB/oral baclofen/botulinum/DBS separation; no unit conversion; no generic PD med stop,keep_hold;collect_evidence;run_regression;review_prepare,promote;export;merge_to_disease_note;apply_preview_promotion,false,Generated from collision_resolution_ledger; not clinical sign-off. Facility spasticity/DBS pathway review,2026-06-05
GAP-V3-COLLISION-CNS-INFECTION-INTRAVENTRICULAR-001,healthcare_associated_cns_infection,HOLD_REFERENCE_ONLY;unresolved_intentional_hold,DO_NOT_EXPORT,unresolved_intentional_hold,NOT_SIGNED_OFF,NO_FACILITY_EVIDENCE,NOT_COMPLETED,UNRESOLVED,NOT_RUN,pharmacist;infectious_disease,IV vancomycin not universal; TDM/toxicity; ID approval; EVD vs meningitis separation,keep_hold;collect_evidence;run_regression;review_prepare,promote;export;merge_to_disease_note;apply_preview_promotion,false,Generated from collision_resolution_ledger; not clinical sign-off. Facility CNS infection and IV antimicrobial SOP,2026-06-05
